{
  "schema_version": "0.1.0",
  "id": "DEC-m1decision01",
  "task_id": "RELAY-1001",
  "gate": "default-evidence-gate",
  "authority": {
    "id": "human:maintainer",
    "type": "human",
    "role": "decision authority"
  },
  "created_at": "2026-07-19T01:13:00Z",
  "outcome": "accept",
  "rationale": "The remediated evidence satisfies both criteria and an independent reviewer recorded a passing review.",
  "evidence_hashes": [
    "2561993331377bb60c11434095c2d8ea3d9ef5b5107afc4ccbe69803f43f5d23"
  ],
  "review_ids": ["REV-m1review002"]
}
